{
  "$schema": "https://agent-project-os.org/schemas/role-assignment-v1.schema.json",
  "agent_id": "agent:project-pm",
  "assigned_at": "2026-08-18T08:00:00Z",
  "assigned_by": "human:maintainer",
  "assignment_id": "agent-project-os-pm",
  "project_id": "agent-project-os",
  "protocol_version": "1.0",
  "role": "accountable_pm",
  "scope": "project",
  "status": "active"
}
