{
  "$schema": "https://agent-project-os.org/schemas/role-assignment-v1.schema.json",
  "agent_id": "agent:contracts-pm", "assigned_at": "2026-08-18T00:00:00Z", "assigned_by": "human:example",
  "assignment_id": "contracts-pm", "project_id": "contracts", "protocol_version": "1.0",
  "role": "accountable_pm", "scope": "project", "status": "active"
}
